{
  "black": "#565655",
  "blue": "#5c92a5",
  "brown": "#a27918",
  "cyan": "#00c9ff",
  "gray": "#848484",
  "green": "#417e2e",
  "lavender": "#a04d78",
  "lime": "#6e9268",
  "natural": "#ccc6a0",
  "orange": "#f6a012",
  "pink": "#ec676a",
  "purple": "#60344a",
  "red": "#861108",
  "tan": "#de9659",
  "turquoise": "#84967f",
  "white": "#fff",
  "yellow": "#e4d057"
}
